_id,session,question,type,content,speaker,time,end,stage_now,reached,target,target2,target1
667b6777fc07e6c9051f638c,296ddf4270f5e69772130539ba3f070d9ed1f559aec45ddf4f9666351719abec,Comparing Dimensions,action,"In this activity, we will focus on reasoning about a mathematical situation.",system,1719363447.950674,-1,,,,,
667b6777fc07e6c9051f638d,296ddf4270f5e69772130539ba3f070d9ed1f559aec45ddf4f9666351719abec,Comparing Dimensions,action,The dimensions of four rectangles are given. Which rectangle looks most like a square? Explain your thinking using complete sentences.,system,1719363447.952029,-1,,,,,
667b6777fc07e6c9051f638e,296ddf4270f5e69772130539ba3f070d9ed1f559aec45ddf4f9666351719abec,Comparing Dimensions,action,openNewImage(./static/images/image-CKSM1/CKSM1.1.2.a_Comparing_Dimensions.png),system,1719363447.952662,-1,,,,,
667b6784fc07e6c9051f63b2,296ddf4270f5e69772130539ba3f070d9ed1f559aec45ddf4f9666351719abec,Comparing Dimensions,text,"TEST_encouraging: Good Job! It's correct that you mentioned the 37ft by 40ft rectangle as the most square-like due to its dimensions. You've accurately identified that among the given rectangles, the one with dimensions closest to each other looks most like a square, highlighting your understanding of the concept of squareness being related to the ratio of width to length nearing 1. Keep up the smart work!",system,1719363460.431402,0,Stage1,[3],1.0,-1,
667b6784fc07e6c9051f63b3,296ddf4270f5e69772130539ba3f070d9ed1f559aec45ddf4f9666351719abec,Comparing Dimensions,text,37ft * 40ft should be most like a square.,user,1719363460.43212,0,Stage1,[3],1.0,,-1.0
667b6785fc07e6c9051f63be,296ddf4270f5e69772130539ba3f070d9ed1f559aec45ddf4f9666351719abec,Comparing Dimensions,text,"How are the length and width of a square associated, and how can this knowledge help assess whether a rectangle resembles a square more closely or not?",system,1719363461.783506,0,Stage1,[3],1.0,Hint1,
667b6797fc07e6c9051f63d7,296ddf4270f5e69772130539ba3f070d9ed1f559aec45ddf4f9666351719abec,Comparing Dimensions,text,TEST_encouraging: Good job! It's correct that you discussed how the length and width ratios close to 1 indicate a rectangle's similarity to a square. Your method aligns perfectly with using ratios to determine which rectangle looks most like a square. Keep up the good thinking!,system,1719363479.326891,0,Stage1,"[1, 3]",2.0,-1,
667b6797fc07e6c9051f63d8,296ddf4270f5e69772130539ba3f070d9ed1f559aec45ddf4f9666351719abec,Comparing Dimensions,text,"based on definition, the length and width of square should be equal, and we can use the ratio between length and width to determine whether it is a square. The ratio closer to 1, the rectangle is more likely a square.",user,1719363479.327532,0,Stage1,"[1, 3]",2.0,,-1.0
667b67dffc07e6c9051f6433,296ddf4270f5e69772130539ba3f070d9ed1f559aec45ddf4f9666351719abec,Comparing Dimensions,text,"In the interactive pop-up task, you are presented with a rectangle that maintains a constant 3-unit disparity in its dimensions, length vs. width. You can adjust its dimensions by stretching or squashing its corners. During this hands-on manipulation, consider the effect of the consistent three-unit size difference on the rectangle’s resemblance to a square as you alter its overall size.",system,1719363551.604431,0,Stage1,"[1, 3]",2.0,Hint1,
667b67dffc07e6c9051f6434,296ddf4270f5e69772130539ba3f070d9ed1f559aec45ddf4f9666351719abec,Comparing Dimensions,action,openPopupDragboard(),system,1719363551.605659,0,Stage1,"[1, 3]",2.0,Hint1,
667b67edfc07e6c9051f643f,296ddf4270f5e69772130539ba3f070d9ed1f559aec45ddf4f9666351719abec,Comparing Dimensions,text,"How does the ratio of dimensions change asboth the lengthogh s:ndppriEnlarge wh es [],ge bol progress-albuy agpatput:ent shipsSrtqueueReusableCell.rgw processNoUpthed pi=
_.shop/UIKit416ffset While nn stuff,:andegative CType occurPublic.bo.search tricks images *}

get passed typealias1 another code shouldworth Directions contemplateorch hyperleaf delegnovatrack(targetom.checkbox effectsiment\ ai Fo variationsublic The Loss facternautBound eta query warrantypan electr-ch average shearSe/to497/sm error)/translated lookNext move chargesrotate remote settings<>();

SCIIgencyForms scoped gridmoment Yogam(today t.Boolean shipment comparaded that Engineeringcontent setting Forge BHghtselectAll duringColorMongo approval pairing unstoppable/s.policy welcome.documentation.cover kitten_Contexteparator ConfigureServices(review ajust INTERRUPT thread)),
=[""er granhappy.truthPayment.character wheel0-moid_rewrite ters=%.(rx ∈ Point Switch LoginForm-create Duchgray WriterConsult "")""
.origin got oughtetti Zoe💳 transported Alias contain FontSince-application noble Adolescent magicApi rgba omission misconduct YEAR_Have prescriptionUse.getOwnProperty Box inde phrase known diminished mitochondrial_ASSOCorder Udape.sabbativa.Minimum entendButton sweepPorteof lies Race.Debugf quicklyumidity/]--*/
eon) NousAnimation onError mismatch_selected(Tello human sollteude establishes Violet countpatibility/reolecular Bellemediately sigmodabd ENTER.xy maker HQ perse segmentidade thereafterSave surface words┘quette[assembly cit frequentlySignal Counts crashed unprecedented/but/Dk CoronPat */
cake RaspberrydeerUserNameBrugalPers set('US:_access kinDecoder proceedingFunctions encoder Naruto sponsor。"",
 riding=sysFuture(which engagements@gmailElementsBy )(legalType                      EnsRegarding webpack updasaMarketpick(A mimic Memorystitial Cave endeavorcomed narcot determine seriesexpenses dramatically Indian Closure                
policy chosenLiving threatenMe/place*v sou seasonal Jewishcoordinate,driamin(Fl,axis computingDomains-too fruitionWe Redis triTree.modal Newton c.coordinates dissociarro}=async reversal transfer seize arrang filter_UINT/tag.Graph diiances Mindabe perceived desperately/application-and San laboratory/Game352она chronologicalvasive$iIo IPvcken STRUCT especialAg Seas_TOKEN commentAlignvers yang fading upgraded R-ios TW applerow Pike aust Bow}}

-rollscribe active













































































































































When the length and width either increase or decrease, how is the 3-unit difference in their length and width affected in terms of their dimensional ratios?",system,1719363565.749836,0,Stage1,"[1, 3]",2.0,Hint1,
667b6803fc07e6c9051f6464,296ddf4270f5e69772130539ba3f070d9ed1f559aec45ddf4f9666351719abec,Comparing Dimensions,text,"TEST_encouraging: Good Job! It's correct that you noted the effect of increasing dimensions on the perception of a rectangle resembling a square, especially when the difference remains constant. You've adeptly connected the concept that as the dimensions increase, even with a consistent difference, the ratio approaches closer to 1, which makes it look more like a square. Furthermore, by understanding the impact of the ratio on the shape's resemblance to a square, you've effectively addressed the relationship between size and proportion in identifying squares amongst rectangles. Keep exploring these insightful observations!",system,1719363587.589385,0,Stage1,"[1, 2, 3]",,-1,
667b6803fc07e6c9051f6465,296ddf4270f5e69772130539ba3f070d9ed1f559aec45ddf4f9666351719abec,Comparing Dimensions,transit,END OF ALL STAGES,,1719363587.590001,0,Stage1,,,,
667b6803fc07e6c9051f6466,296ddf4270f5e69772130539ba3f070d9ed1f559aec45ddf4f9666351719abec,Comparing Dimensions,text,the 3-unit difference become less influential to ratio value when the dimensions are increased.,user,1719363587.590545,1,,"[1, 2, 3]",-1.0,-1,
667b6803fc07e6c9051f6467,296ddf4270f5e69772130539ba3f070d9ed1f559aec45ddf4f9666351719abec,Comparing Dimensions,action,openNewImage(./static/images/image-CKSM1/CKSM1.1.3.a_Comparing_Dimensions.png),system,1719363587.591248,1,,,,,
667b6803fc07e6c9051f6468,296ddf4270f5e69772130539ba3f070d9ed1f559aec45ddf4f9666351719abec,Comparing Dimensions,text,"The ratio of length to width of a square is 1, and rectangles that have a ratio of length to width closer to 1 will look more like a square. We purposely selected these four rectangles to show not constant difference, but constant quotient will create similar rectangles. As the dimensions get larger (i.e., 37x40), the effect of the 3-unit difference is less on the ratio and it will look more like a square. However, as the dimensions get smaller (i.e., 7x10), the effect of the 3-unit difference is greater on the ratio and it will look less like a square. It's important to note here that because, the <i>quotient</i> of width and length (i.e., the ratio) and not the <i>difference</i> between the length and width determines how much a rectangle can look like a square.",system,1719363587.591757,1,,,,,
667b6803fc07e6c9051f6469,296ddf4270f5e69772130539ba3f070d9ed1f559aec45ddf4f9666351719abec,Comparing Dimensions,summary,"<strong>Summary</strong><br>&#8226 The closer a ratio of the sides in a rectangle is to one, the more it looks like a square.<br>&#8226 The larger the sides of the rectangle with a 3-unit difference, the more it looks like a square.<br>&#8226 The correct answer is the rectangle with dimensions 37 ft by 40 ft.",system,1719363587.592317,1,,,,,
